{
  "format": "omi-pack",
  "version": 1,
  "grid": 20,
  "view": [
    -70,
    -70,
    440,
    440
  ],
  "roles": [
    "frame",
    "eye",
    "brow",
    "mouth",
    "tear",
    "extra"
  ],
  "morph": {
    "duration": 0.62,
    "stagger": 0.22,
    "ease": [
      0.65,
      0,
      0.35,
      1
    ],
    "center": [
      150,
      140
    ],
    "splitReach": 140,
    "rolePenalty": 100
  },
  "gaze": {
    "reach": [
      30,
      30
    ],
    "duration": 0.35,
    "ease": [
      0.3,
      0,
      0.2,
      1
    ],
    "roles": [
      "eye"
    ],
    "inside": [
      60,
      60,
      180,
      180
    ]
  },
  "animations": {
    "m-bob": {
      "duration": 2.8,
      "ease": [
        0.42,
        0,
        0.58,
        1
      ],
      "body": true,
      "keys": [
        [
          0,
          {
            "ty": 0
          }
        ],
        [
          0.5,
          {
            "ty": -10
          }
        ],
        [
          1,
          {
            "ty": 0
          }
        ]
      ]
    },
    "m-slow": {
      "duration": 5,
      "ease": [
        0.42,
        0,
        0.58,
        1
      ],
      "body": true,
      "keys": [
        [
          0,
          {
            "ty": 0
          }
        ],
        [
          0.5,
          {
            "ty": -10
          }
        ],
        [
          1,
          {
            "ty": 0
          }
        ]
      ]
    },
    "m-happy": {
      "duration": 1.6,
      "ease": [
        0.42,
        0,
        0.58,
        1
      ],
      "body": true,
      "keys": [
        [
          0,
          {
            "ty": 0
          }
        ],
        [
          0.2,
          {
            "ty": -30
          }
        ],
        [
          0.4,
          {
            "ty": 0
          }
        ],
        [
          0.5,
          {
            "ty": -12
          }
        ],
        [
          0.6,
          {
            "ty": 0
          }
        ],
        [
          1,
          {
            "ty": 0
          }
        ]
      ]
    },
    "peek": {
      "duration": 4.5,
      "ease": [
        0.42,
        0,
        0.58,
        1
      ],
      "keys": [
        [
          0,
          {
            "tx": 0,
            "ty": 0,
            "sx": 1,
            "sy": 1
          }
        ],
        [
          0.5,
          {
            "tx": 0,
            "ty": 0,
            "sx": 1,
            "sy": 1
          }
        ],
        [
          0.75,
          {
            "tx": 0,
            "ty": 180,
            "sx": 1,
            "sy": 1
          }
        ],
        [
          1,
          {
            "tx": 0,
            "ty": 0,
            "sx": 1,
            "sy": 1
          }
        ]
      ]
    },
    "peek-look": {
      "duration": 4.5,
      "ease": [
        0.42,
        0,
        0.58,
        1
      ],
      "keys": [
        [
          0,
          {
            "tx": 0
          }
        ],
        [
          0.05,
          {
            "tx": 0
          }
        ],
        [
          0.11,
          {
            "tx": 10
          }
        ],
        [
          0.18,
          {
            "tx": 10
          }
        ],
        [
          0.26,
          {
            "tx": -20
          }
        ],
        [
          0.36,
          {
            "tx": -20
          }
        ],
        [
          0.44,
          {
            "tx": 0
          }
        ],
        [
          1,
          {
            "tx": 0
          }
        ]
      ]
    },
    "eye": {
      "duration": 0.4,
      "rest": 3.6,
      "ease": [
        0.25,
        0.1,
        0.25,
        1
      ],
      "keys": [
        [
          0,
          {
            "sy": 1
          }
        ],
        [
          0.4,
          {
            "sy": 0.1
          }
        ],
        [
          1,
          {
            "sy": 1
          }
        ]
      ]
    },
    "cur": {
      "duration": 1.05,
      "ease": "steps",
      "keys": [
        [
          0,
          {
            "op": 1
          }
        ],
        [
          0.5,
          {
            "op": 0
          }
        ],
        [
          1,
          {
            "op": 0
          }
        ]
      ]
    },
    "dot": {
      "duration": 1.6,
      "ease": [
        0.25,
        0.1,
        0.25,
        1
      ],
      "keys": [
        [
          0,
          {
            "op": 1
          }
        ],
        [
          0.7,
          {
            "op": 0.25
          }
        ],
        [
          1,
          {
            "op": 1
          }
        ]
      ]
    },
    "look": {
      "duration": 6,
      "ease": [
        0,
        0,
        1,
        1
      ],
      "keys": [
        [
          0,
          {
            "tx": 0
          }
        ],
        [
          0.0625,
          {
            "tx": 7.654
          }
        ],
        [
          0.125,
          {
            "tx": 14.142
          }
        ],
        [
          0.1875,
          {
            "tx": 18.478
          }
        ],
        [
          0.25,
          {
            "tx": 20
          }
        ],
        [
          0.3125,
          {
            "tx": 18.478
          }
        ],
        [
          0.375,
          {
            "tx": 14.142
          }
        ],
        [
          0.4375,
          {
            "tx": 7.654
          }
        ],
        [
          0.5,
          {
            "tx": 0
          }
        ],
        [
          0.5625,
          {
            "tx": -7.654
          }
        ],
        [
          0.625,
          {
            "tx": -14.142
          }
        ],
        [
          0.6875,
          {
            "tx": -18.478
          }
        ],
        [
          0.75,
          {
            "tx": -20
          }
        ],
        [
          0.8125,
          {
            "tx": -18.478
          }
        ],
        [
          0.875,
          {
            "tx": -14.142
          }
        ],
        [
          0.9375,
          {
            "tx": -7.654
          }
        ],
        [
          1,
          {
            "tx": 0
          }
        ]
      ]
    },
    "wave": {
      "duration": 1.2,
      "rest": 0.8,
      "ease": [
        0.42,
        0,
        0.58,
        1
      ],
      "vars": [
        "mx"
      ],
      "keys": [
        [
          0,
          {
            "tx": 0,
            "op": 1
          }
        ],
        [
          0.45,
          {
            "tx": [
              "mx",
              1
            ],
            "op": 0
          }
        ],
        [
          0.5,
          {
            "tx": 0,
            "op": 0
          }
        ],
        [
          0.85,
          {
            "tx": 0,
            "op": 1
          }
        ],
        [
          1,
          {
            "tx": 0,
            "op": 1
          }
        ]
      ]
    },
    "wave2": {
      "duration": 1.2,
      "rest": 0.8,
      "ease": [
        0.42,
        0,
        0.58,
        1
      ],
      "vars": [
        "mx"
      ],
      "keys": [
        [
          0,
          {
            "tx": 0,
            "op": 1
          }
        ],
        [
          0.15,
          {
            "tx": 0,
            "op": 1
          }
        ],
        [
          0.6,
          {
            "tx": [
              "mx",
              1
            ],
            "op": 0
          }
        ],
        [
          0.65,
          {
            "tx": 0,
            "op": 0
          }
        ],
        [
          0.95,
          {
            "tx": 0,
            "op": 1
          }
        ],
        [
          1,
          {
            "tx": 0,
            "op": 1
          }
        ]
      ]
    },
    "z": {
      "duration": 2.6,
      "ease": [
        0,
        0,
        0.58,
        1
      ],
      "keys": [
        [
          0,
          {
            "op": 0,
            "tx": 0,
            "ty": 0
          }
        ],
        [
          0.3,
          {
            "op": 1
          }
        ],
        [
          1,
          {
            "op": 0,
            "tx": 10,
            "ty": -24
          }
        ]
      ]
    },
    "drop": {
      "duration": 1.2,
      "ease": [
        0.42,
        0,
        0.58,
        1
      ],
      "keys": [
        [
          0,
          {
            "ty": 0,
            "op": 1
          }
        ],
        [
          0.45,
          {
            "ty": 10,
            "op": 1
          }
        ],
        [
          0.7,
          {
            "ty": 20,
            "op": 0
          }
        ],
        [
          0.7001,
          {
            "ty": -10,
            "op": 0
          }
        ],
        [
          1,
          {
            "ty": 0,
            "op": 1
          }
        ]
      ]
    },
    "shades": {
      "duration": 3.6,
      "ease": [
        0.2,
        0.8,
        0.2,
        1
      ],
      "keys": [
        [
          0,
          {
            "ty": 0,
            "op": 1
          }
        ],
        [
          0.7,
          {
            "ty": 0,
            "op": 1
          }
        ],
        [
          0.82,
          {
            "ty": 0,
            "op": 0
          }
        ],
        [
          0.8201,
          {
            "ty": -140,
            "op": 0
          }
        ],
        [
          1,
          {
            "ty": 0,
            "op": 1
          }
        ]
      ]
    },
    "ha": {
      "duration": 0.7,
      "ease": [
        0.42,
        0,
        0.58,
        1
      ],
      "keys": [
        [
          0,
          {
            "tx": 0,
            "ty": 0,
            "sx": 1,
            "sy": 1,
            "op": 1
          }
        ],
        [
          0.5,
          {